<?xml version="1.0" encoding="UTF-8"?>
<!DOCTYPE parameters PUBLIC "-//UniTime//UniTime Room Availability DTD/EN" "http://www.unitime.org/interface/RoomAvailability.dtd">

<!-- 
 * Licensed to The Apereo Foundation under one or more contributor license
 * agreements. See the NOTICE file distributed with this work for
 * additional information regarding copyright ownership.
 *
 * The Apereo Foundation licenses this file to you under the Apache License,
 * Version 2.0 (the "License"); you may not use this file except in
 * compliance with the License. You may obtain a copy of the License at:
 *
 * http://www.apache.org/licenses/LICENSE-2.0
 *
 * Unless required by applicable law or agreed to in writing, software
 * distributed under the License is distributed on an "AS IS" BASIS,
 * WITHOUT WARRANTIES OR CONDITIONS OF ANY KIND, either express or implied.
 *
 * See the License for the specific language governing permissions and
 * limitations under the License.
 * 
 -->
 
 <parameters created="Tue Sep 27 14:47:23 CEST 2011">
  <year value="2010"/>
  <term value="Fal"/>
  <campus value="woebegon"/>
  <beginDate value="12/13/2010"/>
  <endDate value="12/16/2010"/>
  <startTime value="08:00"/>
  <endTime value="16:00"/>
</parameters>